{
  "schemaVersion": 1,
  "status": "running",
  "workflowId": "prism",
  "workflowVersion": "3.1.0",
  "agentId": "sidecar-probe",
  "executionPath": "agent",
  "sessionIndex": "7MXAYM",
  "planningFolderPath": "/var/lib/workflow-server/projects/workflow-server/.engineering/artifacts/planning/2026-09-16-routine-operation-sidecar",
  "frontier": [
    "adversarial-pass"
  ],
  "currentTechnique": "",
  "exit": "",
  "seq": 2,
  "ts": 1789560980,
  "startedAt": "2026-09-16T12:16:11.264Z",
  "completedActivities": [],
  "variables": {
    "component_path": ".",
    "host_repo_path": "/var/lib/workflow-server/projects/workflow-server",
    "is_monorepo": false,
    "output_path": ".",
    "target_repo": "m2ux/workflow-server",
    "user_request": "Exercise the per-unit-pass routine through a live server."
  },
  "checkpointResponses": {},
  "history": [
    {
      "timestamp": "2026-09-16T12:16:11.264Z",
      "type": "workflow_started"
    },
    {
      "data": {
        "variables": {
          "component_path": ".",
          "host_repo_path": "/var/lib/workflow-server/projects/workflow-server",
          "is_monorepo": false,
          "output_path": ".",
          "target_repo": "m2ux/workflow-server",
          "user_request": "Exercise the per-unit-pass routine through a live server."
        }
      },
      "timestamp": "2026-09-16T12:16:11.264Z",
      "type": "variables_seeded"
    },
    {
      "activity": "adversarial-pass",
      "timestamp": "2026-09-16T12:16:17.763Z",
      "type": "activity_entered"
    },
    {
      "activity": "adversarial-pass",
      "data": {
        "agentId": "sidecar-probe-worker",
        "chars": 44903,
        "dispatch": "fresh"
      },
      "timestamp": "2026-09-16T12:16:20.831Z",
      "type": "activity_dispatched"
    },
    {
      "activity": "adversarial-pass",
      "data": {
        "agentId": "sidecar-probe-worker",
        "bundled_steps": 0,
        "delivery": "full",
        "eager_budget_chars": 640000,
        "provenance_passes": 0,
        "resolved_techniques": 31,
        "spent_chars": 43150
      },
      "timestamp": "2026-09-16T12:16:20.831Z",
      "type": "activity_delivered"
    }
  ],
  "triggeredWorkflows": [],
  "contextMode": "persistent",
  "deliveredContent": {
    "sidecar-probe-worker": {
      "activity_rules:011a0a19d0150379": "011a0a19d0150379",
      "bundle:agent-conduct": "9cf9756649880f04",
      "bundle:rules:16238b2a38bbbad4": "16238b2a38bbbad4",
      "bundle:scatter-gather": "14b84145be32c339",
      "bundle:variable-binding": "20f1b5523bf48665",
      "bundle:worker-conduct": "2f658c2399e3ea8c",
      "bundle:workflow-engine::activity-worker": "a1cf2b3b1c6c04c1",
      "bundle:workflow-engine::finalize-activity": "4048687f39a57dc8",
      "bundle:workflow-engine::resume-from-checkpoint": "b64a82e406ffbef6",
      "bundle:workflow-engine::yield-checkpoint": "19bd3b7f355aab3e"
    }
  },
  "repo": "m2ux/workflow-server"
}