{
  "schemaVersion": 1,
  "status": "running",
  "workflowId": "routines-demo",
  "workflowVersion": "1.0.0",
  "agentId": "orchestrator",
  "executionPath": "agent",
  "sessionIndex": "VKSCZI",
  "planningFolderPath": "/var/lib/workflow-server/projects/workflow-server/.engineering/artifacts/planning/2026-09-15-routines-demo-4",
  "frontier": [
    "close-review"
  ],
  "currentTechnique": "",
  "exit": "done",
  "seq": 9,
  "ts": 1789479790,
  "startedAt": "2026-09-15T13:40:18.861Z",
  "completedActivities": [
    "open-review"
  ],
  "variables": {
    "batch_outcome": "walking",
    "component_path": ".",
    "finding_outcome": "deferred",
    "host_repo_path": "/var/lib/workflow-server/projects/workflow-server",
    "is_monorepo": false,
    "open_findings": [
      {
        "id": "f1",
        "title": "the splicer was blind to loop containers"
      },
      {
        "id": "f2",
        "title": "binding-fidelity cannot see a routine"
      }
    ],
    "review_presentation": "three findings remain",
    "review_summary": "One finding was resolved and one deferred.",
    "review_topic": "the routines construct",
    "target_repo": "m2ux/workflow-server",
    "user_request": "Exercise the routine construct end to end before merge."
  },
  "checkpointResponses": {
    "open-review-review-findings.batch-gate": {
      "effects": {
        "variablesSet": {
          "batch_outcome": "walking"
        }
      },
      "optionId": "review-each",
      "respondedAt": "2026-09-15T13:42:16.000Z"
    },
    "open-review-review-findings.review.decide#f1": {
      "effects": {
        "variablesSet": {
          "finding_outcome": "resolved"
        }
      },
      "optionId": "resolve",
      "respondedAt": "2026-09-15T13:42:58.000Z"
    },
    "open-review-review-findings.review.decide#f2": {
      "effects": {
        "variablesSet": {
          "finding_outcome": "deferred"
        }
      },
      "optionId": "defer",
      "respondedAt": "2026-09-15T13:43:04.000Z"
    }
  },
  "history": [
    {
      "timestamp": "2026-09-15T13:40:18.861Z",
      "type": "workflow_started"
    },
    {
      "data": {
        "variables": {
          "component_path": ".",
          "host_repo_path": "/var/lib/workflow-server/projects/workflow-server",
          "is_monorepo": false,
          "open_findings": [],
          "review_presentation": "three findings remain",
          "review_topic": "the routines construct",
          "target_repo": "m2ux/workflow-server",
          "user_request": "Exercise the routine construct end to end before merge."
        }
      },
      "timestamp": "2026-09-15T13:40:18.861Z",
      "type": "variables_seeded"
    },
    {
      "data": {
        "name": "open_findings",
        "source": "variables_changed",
        "value": [
          {
            "id": "f1",
            "title": "the splicer was blind to loop containers"
          },
          {
            "id": "f2",
            "title": "binding-fidelity cannot see a routine"
          }
        ]
      },
      "timestamp": "2026-09-15T13:40:25.718Z",
      "type": "variable_set"
    },
    {
      "activity": "open-review",
      "timestamp": "2026-09-15T13:40:25.718Z",
      "type": "activity_entered"
    },
    {
      "activity": "open-review",
      "data": {
        "agentId": "orchestrator",
        "chars": 5019,
        "dispatch": "fresh"
      },
      "timestamp": "2026-09-15T13:40:32.272Z",
      "type": "activity_dispatched"
    },
    {
      "activity": "open-review",
      "data": {
        "agentId": "orchestrator",
        "chars": 1239,
        "delivery": "full",
        "stepId": "review-findings.summarise",
        "techniqueId": "review::summarise"
      },
      "timestamp": "2026-09-15T13:40:32.272Z",
      "type": "technique_bundled"
    },
    {
      "activity": "open-review",
      "data": {
        "agentId": "orchestrator",
        "stepId": "review-findings.summarise"
      },
      "timestamp": "2026-09-15T13:40:32.272Z",
      "type": "step_started"
    },
    {
      "activity": "open-review",
      "data": {
        "agentId": "orchestrator",
        "bundled_steps": 1,
        "delivery": "full",
        "eager_budget_chars": 640000,
        "provenance_passes": 1,
        "resolved_techniques": 1,
        "spent_chars": 1446
      },
      "timestamp": "2026-09-15T13:40:32.272Z",
      "type": "activity_delivered"
    },
    {
      "activity": "open-review",
      "checkpoint": "review-findings.batch-gate",
      "timestamp": "2026-09-15T13:40:48.163Z",
      "type": "checkpoint_reached"
    },
    {
      "activity": "open-review",
      "checkpoint": "review-findings.batch-gate",
      "data": {
        "optionId": "review-each"
      },
      "timestamp": "2026-09-15T13:42:16.000Z",
      "type": "checkpoint_response"
    },
    {
      "activity": "open-review",
      "data": {
        "name": "batch_outcome",
        "source": "setVariable",
        "value": "walking"
      },
      "timestamp": "2026-09-15T13:42:16.000Z",
      "type": "variable_set"
    },
    {
      "activity": "open-review",
      "checkpoint": "review-findings.review.decide#f1",
      "timestamp": "2026-09-15T13:42:19.938Z",
      "type": "checkpoint_reached"
    },
    {
      "activity": "open-review",
      "checkpoint": "review-findings.review.decide#f1",
      "data": {
        "optionId": "resolve"
      },
      "timestamp": "2026-09-15T13:42:58.000Z",
      "type": "checkpoint_response"
    },
    {
      "activity": "open-review",
      "data": {
        "name": "finding_outcome",
        "source": "setVariable",
        "value": "resolved"
      },
      "timestamp": "2026-09-15T13:42:58.000Z",
      "type": "variable_set"
    },
    {
      "activity": "open-review",
      "checkpoint": "review-findings.review.decide#f2",
      "timestamp": "2026-09-15T13:43:01.622Z",
      "type": "checkpoint_reached"
    },
    {
      "activity": "open-review",
      "checkpoint": "review-findings.review.decide#f2",
      "data": {
        "optionId": "defer"
      },
      "timestamp": "2026-09-15T13:43:04.000Z",
      "type": "checkpoint_response"
    },
    {
      "activity": "open-review",
      "data": {
        "name": "finding_outcome",
        "source": "setVariable",
        "value": "deferred"
      },
      "timestamp": "2026-09-15T13:43:04.000Z",
      "type": "variable_set"
    },
    {
      "activity": "open-review",
      "timestamp": "2026-09-15T13:43:10.596Z",
      "type": "activity_exited"
    },
    {
      "activity": "open-review",
      "data": {
        "name": "review_summary",
        "source": "variables_changed",
        "value": "One finding was resolved and one deferred."
      },
      "timestamp": "2026-09-15T13:43:10.596Z",
      "type": "variable_set"
    },
    {
      "activity": "open-review",
      "data": {
        "stepId": "announce"
      },
      "timestamp": "2026-09-15T13:43:10.596Z",
      "type": "step_completed"
    },
    {
      "activity": "open-review",
      "data": {
        "stepId": "review-findings.batch-gate"
      },
      "timestamp": "2026-09-15T13:43:10.596Z",
      "type": "step_completed"
    },
    {
      "activity": "open-review",
      "data": {
        "stepId": "review-findings.review"
      },
      "timestamp": "2026-09-15T13:43:10.596Z",
      "type": "step_completed"
    },
    {
      "activity": "open-review",
      "data": {
        "stepId": "review-findings.summarise"
      },
      "timestamp": "2026-09-15T13:43:10.596Z",
      "type": "step_completed"
    },
    {
      "activity": "close-review",
      "timestamp": "2026-09-15T13:43:10.596Z",
      "type": "activity_entered"
    }
  ],
  "triggeredWorkflows": [],
  "deliveredContent": {
    "orchestrator": {
      "technique:provenance_note:10b5dee320dee4be": "10b5dee320dee4be",
      "technique:review::summarise": "f905bb73314b4e0e"
    }
  },
  "repo": "m2ux/workflow-server"
}